{
  "vct": "eu.we-build:control:1",
  "iss": "https://issuer.example.com",
  "iat": 1736935200,
  "exp": 1768471200,
  "attestation_legal_category": "EAA",
  "schema_version": "0.9.0",
  "trust_anchor_url": "https://trust.webuildconsortium.eu/anchors/eidas-tl",
  "controller": [
    {
      "type": "Person",
      "jurisdiction": "DE",
      "person": {
        "first_name": "Alice",
        "surname": "Smith",
        "birth_date": "1975-03-20"
      },
      "address": {
        "street": "Hauptstrasse",
        "house_number": "10",
        "locality": "Berlin",
        "region": "Berlin",
        "postal_code": "10115",
        "country": "DE"
      },
      "controls": {
        "type": [
          "voting_rights",
          "board"
        ],
        "level": "direct",
        "basis": "shareholding",
        "voting_percentage": 60.0,
        "appointment_rights": "Right to appoint majority of supervisory board",
        "rights": [
          "dividend_rights",
          "liquidation_rights"
        ]
      },
      "effective_date": "2020-01-15",
      "evidence": [
        {
          "id": "src-001",
          "type": "officialRegister",
          "url": "https://example.com/docs/shareholder-register-2024.pdf"
        }
      ]
    },
    {
      "type": "Entity",
      "jurisdiction": "DE",
      "entity": {
        "category": "legal_entity",
        "name": "HoldCo GmbH",
        "identifier": {
          "euid": "DE987654321",
          "lei": "529900T8BM49AURSDO55",
          "tax": "DE123456789"
        },
        "jurisdiction": "DE",
        "form": "private_company",
        "legal_form": "GmbH"
      },
      "address": {
        "street": "Musterstra\u00dfe",
        "house_number": "45",
        "locality": "Frankfurt",
        "region": "Hessen",
        "postal_code": "60311",
        "country": "DE"
      },
      "controls": {
        "type": [
          "nominee",
          "voting_rights"
        ],
        "level": "indirect",
        "basis": "shareholding",
        "voting_percentage": 40.0,
        "rights": [
          "dividend_rights"
        ]
      },
      "effective_date": "2019-06-01",
      "evidence": [
        {
          "id": "src-002",
          "type": "governanceChart",
          "url": "https://example.com/docs/governance-chart-2024.pdf"
        }
      ]
    },
    {
      "type": "Entity",
      "jurisdiction": "LU",
      "entity": {
        "category": "legal_arrangement",
        "name": "Smith Family Trust",
        "identifier": {
          "lei": "549300ABCDEF12345678"
        },
        "jurisdiction": "LU",
        "form": "trust",
        "subtype_info": {
          "settlement": "Settled under Luxembourg trust law on 2015-03-01",
          "purpose": "Family wealth management and succession planning",
          "assets": "Real estate, securities portfolios, and cash holdings",
          "reason_for_registration": "Registered for tax transparency under CRS"
        },
        "legal_form": "SA"
      },
      "address": {
        "street": "Rue de la Forêt",
        "house_number": "7",
        "locality": "Luxembourg",
        "region": "Luxembourg",
        "postal_code": "L-1234",
        "country": "LU"
      },
      "controls": {
        "type": [
          "agreements",
          "other_means_of_control"
        ],
        "level": "indirect",
        "basis": "trust_arrangement",
        "voting_percentage": 0.0,
        "other_details": "Control exercised through trustee appointment rights over beneficiary assets",
        "rights": [
          "dividend_rights",
          "liquidation_rights"
        ]
      },
      "effective_date": "2015-03-01",
      "evidence": [
        {
          "id": "src-003",
          "type": "trustDeed",
          "url": "https://example.com/docs/trust-deed-2015.pdf"
        }
      ]
    }
  ],
  "status": {
    "type": "status-list",
    "status_list_credential": "https://issuer.example.com/status/control/2025",
    "status_list_index": 456,
    "status_purpose": "revocation"
  },
  "cnf": {
    "jwk": {
      "kty": "EC",
      "crv": "P-256",
      "x": "TCAER19Zvu3OHF4j4W4vfSVoHIP1ILilDls7vCeGemc",
      "y": "ZxjiWWbZMQGHVWKVQ4hbSIirsVfuecCE6t4jT9F2HZQ"
    }
  }
}